{
  "status": "ok",
  "graph": {
    "graphType": "line",
    "title": "Average Temperature by Month",
    "xAxis": {
      "label": "Month",
      "values": ["January", "February", "March", "April", "May"]
    },
    "yAxis": {
      "label": "Temperature",
      "unit": "°C"
    },
    "series": [
      {
        "name": "Milan",
        "values": [4, 7, 12, 15, 19]
      },
      {
        "name": "Palermo",
        "values": [12, 13, 15, 18, 22]
      }
    ],
    "summary": "Temperature rises steadily across the displayed period for both cities.",
    "confidence": 0.91
  },
  "fieldConfidence": {
    "graphType": 0.98,
    "title": 0.95,
    "xAxis": 0.93,
    "yAxis": 0.9,
    "series": 0.88
  },
  "message": null
}
