{
  "status": "ok",
  "graph": {
    "graphType": "line",
    "title": "Average Temperature by Month",
    "xAxis": {
      "label": "Month",
      "values": [
        "January",
        "February",
        "March",
        "April",
        "May"
      ]
    },
    "yAxis": {
      "label": "Temperature (\"\b°C\")",
      "unit": "°C"
    },
    "series": [
      {
        "name": "Milan",
        "values": [
          4.0,
          7.0,
          12.0,
          15.0,
          19.0
        ]
      },
      {
        "name": "Palermo",
        "values": [
          12.0,
          13.0,
          15.0,
          18.0,
          21.5
        ]
      }
    ],
    "summary": "Both Milan and Palermo show a clear increasing trend in average temperature from January to May, with Palermo consistently having higher average temperatures than Milan throughout this period.",
    "confidence": 0.98
  },
  "fieldConfidence": {
    "graphType": 1.0,
    "title": 1.0,
    "xAxis": 1.0,
    "yAxis": 1.0,
    "series": 0.98
  },
  "message": null
}